rank,method_id,label,method_type,op_focus,note,wf_races,wf_hits,wf_wagered,wf_profit,wf_roi,wf_hit_rate,wf_positive_years,wf_observed_years,holdout_races,holdout_hits,holdout_wagered,holdout_profit,holdout_roi,holdout_hit_rate,holdout_positive_years,holdout_observed_years,score
1,phase7_live_portfolio,Phase 7 live portfolio,fixed portfolio,False,"Frozen 3-rule baseline. BEL contributes zero 2024-2025 races, so the current holdout is effectively the OP+CD legs.",806,200,127680.0,40013.49,31.34,24.81,9,10,175,48,26400.0,10210.61,38.68,27.43,2,2,89.7
2,phase8_frozen_portfolio,Phase 8 frozen portfolio,fixed portfolio,False,"Frozen 7-rule Phase 8 basket. Useful as the headline multi-track challenger, but still full-history-mined before this replay.",625,183,129000.0,71006.6,55.04,29.28,10,10,118,41,26040.0,5585.05,21.45,34.75,2,2,87.9
3,op_refined_only,OP refined only,fixed OP rule,True,"Higher-ROI OP variant with a much smaller forward sample. Treat as selective, not as the new default.",207,41,24840.0,16418.6,66.1,19.81,8,10,49,10,5880.0,3023.8,51.43,20.41,1,2,69.9
4,op_train_switch,OP train-score switch,dynamic OP selector,True,"Each year, pick the better-qualifying OP rule by train-only selection score. Recent picks: 2022=OP_DURABLE_K7, 2023=OP_DURABLE_K7, 2024=OP_REFINED_K7, 2025=OP_REFINED_K7.",350,64,42000.0,19934.6,47.46,18.29,8,10,49,10,5880.0,3023.8,51.43,20.41,1,2,68.4
5,op_durable_only,OP durable only,fixed OP rule,True,"Largest-sample OP anchor. Lower upside than the refined OP variant, but materially more forward races.",416,75,49920.0,20070.4,40.21,18.03,8,10,115,21,13800.0,3159.6,22.9,18.26,1,2,67.4
6,train_only_selector,Train-only yearly selector,dynamic selector,False,"The current honest selector baseline from walk_forward_validation.py. Historical context includes the pre-existing BEL bridge candidate in some earlier folds, but no new aliasing is added here.",470,108,78108.0,17541.35,22.46,22.98,8,10,65,18,11256.0,1616.25,14.36,27.69,1,2,61.9
